{
  "format": "arcane.prefab",
  "next_id": 9,
  "nodes": [
    {
      "components": [
        {
          "id": 2,
          "properties": {
            "atlas": 0,
            "flip_x": false,
            "flip_y": false,
            "height": 24.0,
            "region": "",
            "texture": 1617945095526466553,
            "tint": [
              1.0,
              0.2,
              0.2,
              1.0
            ],
            "width": 24.0
          },
          "type": "Sprite"
        },
        {
          "id": 3,
          "properties": {
            "body_type": 2,
            "fixed_rotation": true,
            "gravity_scale": 0.0,
            "linear_velocity": [
              0.0,
              0.0
            ]
          },
          "type": "RigidBody2D"
        },
        {
          "id": 4,
          "properties": {
            "density": 1.0,
            "friction": 0.0,
            "height": 24.0,
            "is_sensor": false,
            "layer": 2,
            "mask": 11,
            "mirror_with_sprite": false,
            "offset": [
              0.0,
              0.0
            ],
            "one_way": false,
            "radius": 16.0,
            "restitution": 0.0,
            "shape_type": 0,
            "width": 24.0
          },
          "type": "Collider2D"
        },
        {
          "id": 5,
          "properties": {
            "allow_diagonal": true,
            "behavior": 0,
            "max_acceleration": 600.0,
            "max_speed": 65.0,
            "repath_interval": 0.5,
            "slow_radius": 48.0,
            "stop_distance": 4.0,
            "target": "Player",
            "tilemap": "",
            "use_pathfinding": true
          },
          "type": "SteeringAgent2D"
        },
        {
          "id": 6,
          "properties": {
            "destroy_on_death": true,
            "invulnerability_time": 0.5,
            "max_health": 3.0,
            "release_on_death": true
          },
          "type": "Health"
        },
        {
          "id": 7,
          "properties": {
            "damage_multiplier": 1.0,
            "health_node": ""
          },
          "type": "Hurtbox"
        },
        {
          "id": 8,
          "properties": {
            "active": true,
            "damage": 1.0,
            "ignore_own_hierarchy": true,
            "rehit_interval": 0.5
          },
          "type": "Hitbox"
        }
      ],
      "id": 1,
      "name": "Enemy",
      "parent_id": 0,
      "position": [
        450.0,
        240.0
      ],
      "rotation_radians": 0.0,
      "scale": [
        1.0,
        1.0
      ]
    }
  ],
  "version": 1
}
