{
  "format": "arcane.prefab",
  "next_id": 6,
  "nodes": [
    {
      "components": [
        {
          "id": 2,
          "properties": {
            "atlas": 0,
            "flip_x": false,
            "flip_y": false,
            "height": 14.0,
            "region": "",
            "texture": 1617945095526466553,
            "tint": [
              1.0,
              0.85,
              0.2,
              1.0
            ],
            "width": 14.0
          },
          "type": "Sprite"
        },
        {
          "id": 3,
          "properties": {
            "body_type": 1,
            "fixed_rotation": true,
            "gravity_scale": 0.0,
            "linear_velocity": [
              0.0,
              0.0
            ]
          },
          "type": "RigidBody2D"
        },
        {
          "id": 4,
          "properties": {
            "density": 1.0,
            "friction": 0.0,
            "height": 14.0,
            "is_sensor": true,
            "layer": 5,
            "mask": 2,
            "mirror_with_sprite": false,
            "offset": [
              0.0,
              0.0
            ],
            "one_way": false,
            "radius": 16.0,
            "restitution": 0.0,
            "shape_type": 0,
            "width": 14.0
          },
          "type": "Collider2D"
        },
        {
          "id": 5,
          "properties": {
            "value": 1.0
          },
          "type": "CoinPickup"
        }
      ],
      "id": 1,
      "name": "Coin",
      "parent_id": 0,
      "position": [
        0.0,
        0.0
      ],
      "rotation_radians": 0.0,
      "scale": [
        1.0,
        1.0
      ]
    }
  ],
  "version": 1
}
